{
  "$schema": "../schemas/run-v1.schema.json",
  "format": "drop7-run-v1",
  "runId": "RUN-20260820T000000Z-00000000",
  "experimentId": "EX-20260820-replace-slug-00000000",
  "lifecycle": "planned",
  "runValidity": "pending",
  "startedAt": null,
  "endedAt": null,
  "protocolSha256": "0000000000000000000000000000000000000000000000000000000000000000",
  "machineProfileRef": "REPLACE_MACHINE_PROFILE_PATH",
  "sourceState": {
    "gitCommit": null,
    "dirty": null,
    "diffSha256": null,
    "sourceArchiveSha256": null
  },
  "command": [
    "REPLACE_EXECUTABLE",
    "REPLACE_ARGUMENT"
  ],
  "seedLeaseRefs": [],
  "resourceLimits": {
    "wallSeconds": null,
    "cpuThreads": null,
    "maxHostBytes": null,
    "maxGpuBytes": null
  },
  "resourceObserved": {
    "wallSeconds": null,
    "cpuSeconds": null,
    "peakHostBytes": null,
    "peakGpuBytes": null,
    "measurementNotes": "Not started."
  },
  "exitCode": null,
  "stopReason": null,
  "artifactRefs": [],
  "contributionIds": []
}
