{
  "$schema": "../schemas/run-v1.schema.json",
  "format": "drop7-run-v1",
  "runId": "RUN-20260902T035644Z-c1fd8987",
  "experimentId": "EX-20260902-nnue-evolution-d3-v2-49c18bc2",
  "lifecycle": "completed",
  "runValidity": "valid",
  "startedAt": "2026-09-02T04:24:10Z",
  "endedAt": "2026-09-03T02:52:23Z",
  "protocolSha256": "971a39ef6bb5275a951342245a119cb3d234bed334aa28e2ecfe44eeeeea4dae",
  "machineProfileRef": "research/system-profiles/MACH-20260902T035644Z-f5e59b6e.json",
  "sourceState": {
    "gitCommit": "dbe0bc83641eb07766de2ec4c4df1149ba7b64fd",
    "dirty": true,
    "diffSha256": null,
    "sourceArchiveSha256": null
  },
  "command": [
    "approaches/lifetime-objective/nnue-evolution/build.sh (RUSTFLAGS=-C target-cpu=native, cargo 1.x stable, release, lto fat)",
    "cargo test --release (9 unit tests)",
    "target/release/gate 0xa5277000 -> runs/RUN-20260902T035644Z-c1fd8987/nnue-evolution/gates.log (11 CHECK gates, probe block only)",
    "target/release/teacher_corpus --seeds-start 0xa5277800 --games 64 --threads {16,32} --depth 4 (seed-free SMT scaling preflight on the already-opened probe block)",
    "RUN_ID=RUN-20260902T035644Z-c1fd8987 THREADS=32 CORPUS_WALL=46800 scripts/pipeline.sh corpus (stage A, seeds 0xa52e0300-0xa52e0500, --move-cap 500)",
    "RUN_ID=RUN-20260902T035644Z-c1fd8987 THREADS=32 scripts/pipeline.sh pretrain (stage B)",
    "RUN_ID=RUN-20260902T035644Z-c1fd8987 THREADS=32 EVOLVE_WALL=21600 scripts/pipeline.sh evolve (stage C, fitness blocks from 0xa52e0500)",
    "RUN_ID=RUN-20260902T035644Z-c1fd8987 THREADS=32 scripts/pipeline.sh select (stage C, re-selection block 0xa52e0c80, candidate SHA-256 recorded)",
    "RUN_ID=RUN-20260902T035644Z-c1fd8987 THREADS=32 scripts/pipeline.sh screen (stage D, 0xa52e1300-0xa52e133f, once)",
    "RUN_ID=RUN-20260902T035644Z-c1fd8987 scripts/pipeline.sh compare (leaf-evolution/compare.py, bootstrap seed 0xb0071eaf)",
    "2026-09-02 (before stage C): evolve.rs and screen.rs experiment-id string updated to EX-20260902-nnue-evolution-d3-v2-49c18bc2 and the crate rebuilt (cargo test --release rerun); teacher_corpus source unchanged and the running stage A process continued from its original image",
    "target/release/leaf_swing --parts <run>/leaf-swing-input (a frozen snapshot of the part files finished at the time; seed list in leaf-swing-input-seeds.txt) --roots {400,80,8} --depth {3,4,5} --threads 4: diagnostic on already-opened training-role corpus roots (leaf share of sibling spread); no seed opened"
  ],
  "seedLeaseRefs": [
    "SL-20260825T063000Z-a52e0300",
    "SL-20260825T063000Z-a52e1300"
  ],
  "resourceLimits": {
    "wallSeconds": 86400,
    "cpuThreads": 32,
    "maxHostBytes": 17179869184,
    "maxGpuBytes": null
  },
  "resourceObserved": {
    "wallSeconds": 80893,
    "cpuSeconds": 2130697.7,
    "peakHostBytes": 1792266240,
    "peakGpuBytes": null,
    "measurementNotes": "Run in progress; per-stage kernel rusage is appended to runs/RUN-20260902T035644Z-c1fd8987/nnue-evolution/rusage.jsonl by scripts/with-rusage.py. Interim timing at +2.2 h (2026-09-02T06:40Z): 22 of 512 teacher games finished; finished games cost 37-87 s per depth-5 root per thread at 32 threads (teacher_corpus at 3190% CPU, 1.58 GB RSS, cores at ~3.74 GHz), 4-7x the quiet single-thread 9.5-13.6 s of the August 25 T0 pilot. A single-thread decide of one finished corpus root (seed 0xa52e0315 move 15) under the same load cost 52.7 s with the 1M-entry table (107.6M work), 56.4 s at 256K (122.7M work) and 75.4 s at 64K (160.9M work): the per-thread table is not the bottleneck and a smaller one would cost more work, so the configuration was left unchanged. Projection: roughly 200 whole teacher games by the 46,800 s new-game cutoff, then an in-flight tail; the frozen stop rule keeps whatever whole games completed as the corpus. Record note: launched under EX-20260825-nnue-evolution-d3-bca7f330 as amended in place; that record was superseded by EX-20260902-nnue-evolution-d3-v2-49c18bc2 (identical protocol content) after PR #17 review; this run record and the opened lease now carry the successor's preregistration hash. 2026-09-02T22:09:38Z: the unattended chain (pipeline.sh chain) aborted on a single false negative of its process-table liveness probe while teacher_corpus (PID 4064131) was still playing its last in-flight game; no stage had started and no artifact was touched. The probe now requires three consecutive pgrep misses 10 s apart; the chain was relaunched at 22:10:58Z and resumed waiting for the corpus marker. Correction at 2026-09-02T22:42Z: replacing pipeline.sh by rename did not protect the running corpus stage. teacher_corpus itself exited 0 at 22:39:58Z (177 games, 21,618 roots, corpus.jsonl and corpus-summary.json assembled, rusage.jsonl written), but the stage's shell then read the replaced file and failed with a syntax error on its final line, so the 'corpus: done' marker was never logged and the relaunched chain aborted again at 22:41:23Z. The marker was appended to pipeline.log by hand at 22:42:11Z with a note saying so, the chain was relaunched, and pretrain started at 22:42:11Z. No corpus artifact was affected. Rule for this run from here on: pipeline.sh is not edited or replaced while any stage is executing. Final: wall 80893 s from launch to analysis; per-stage kernel rusage in rusage.jsonl (corpus wall 65748 s, cpu 1668588 s, peak RSS 1.62 GB, exit 0; pretrain wall 14 s, cpu 45 s, peak RSS 0.27 GB, exit 0; evolve wall 14094 s, cpu 441858 s, peak RSS 0.48 GB, exit 0; select wall 250 s, cpu 7856 s, peak RSS 0.25 GB, exit 0; screen wall 653 s, cpu 12351 s, peak RSS 1.79 GB, exit 0). Result record RS-20260903T025751Z-6577b33e."
  },
  "exitCode": 0,
  "stopReason": "completed: corpus to the wall cutoff (177 whole games), pretrain, 60 generations, elite re-selection, held-out screen played once, compare and analysis written",
  "artifactRefs": [
    "runs/RUN-20260902T035644Z-c1fd8987/nnue-evolution/gates.log",
    "runs/RUN-20260902T035644Z-c1fd8987/nnue-evolution/preflight-d4-t16.log",
    "runs/RUN-20260902T035644Z-c1fd8987/nnue-evolution/preflight-d4-t32.log",
    "runs/RUN-20260902T035644Z-c1fd8987/nnue-evolution/pipeline.log",
    "runs/RUN-20260902T035644Z-c1fd8987/nnue-evolution/rusage.jsonl",
    "runs/RUN-20260902T035644Z-c1fd8987/nnue-evolution/leaf-swing-d3.txt",
    "runs/RUN-20260902T035644Z-c1fd8987/nnue-evolution/leaf-swing-d4.txt",
    "runs/RUN-20260902T035644Z-c1fd8987/nnue-evolution/leaf-swing-d5.txt",
    "runs/RUN-20260902T035644Z-c1fd8987/nnue-evolution/leaf-swing-input-seeds.txt",
    "runs/RUN-20260902T035644Z-c1fd8987/nnue-evolution/screen/heldout.json",
    "runs/RUN-20260902T035644Z-c1fd8987/nnue-evolution/screen/compare-candidate-vs-fair-d3s7.json",
    "runs/RUN-20260902T035644Z-c1fd8987/nnue-evolution/screen/compare-init-vs-fair-d3s7.json",
    "runs/RUN-20260902T035644Z-c1fd8987/nnue-evolution/screen/compare-candidate-vs-init.json",
    "runs/RUN-20260902T035644Z-c1fd8987/nnue-evolution/screen/compare-fair-d4s7-vs-fair-d3s7.json",
    "runs/RUN-20260902T035644Z-c1fd8987/nnue-evolution/evolve/selection.json",
    "runs/RUN-20260902T035644Z-c1fd8987/nnue-evolution/evolve/candidate-weights.bin",
    "runs/RUN-20260902T035644Z-c1fd8987/nnue-evolution/evolve/candidate-weights.sha256",
    "runs/RUN-20260902T035644Z-c1fd8987/nnue-evolution/evolve/config.json",
    "runs/RUN-20260902T035644Z-c1fd8987/nnue-evolution/evolve/progress.jsonl",
    "runs/RUN-20260902T035644Z-c1fd8987/nnue-evolution/pretrain/init.bin",
    "runs/RUN-20260902T035644Z-c1fd8987/nnue-evolution/pretrain/report.json",
    "runs/RUN-20260902T035644Z-c1fd8987/nnue-evolution/pretrain/probe.json",
    "runs/RUN-20260902T035644Z-c1fd8987/nnue-evolution/corpus/corpus-summary.json",
    "runs/RUN-20260902T035644Z-c1fd8987/nnue-evolution/analysis.json",
    "runs/RUN-20260902T035644Z-c1fd8987/nnue-evolution/analysis.md",
    "runs/RUN-20260902T035644Z-c1fd8987/nnue-evolution/corpus/corpus.jsonl",
    "runs/RUN-20260902T035644Z-c1fd8987/nnue-evolution/evolve/gen-000.json .. gen-059.json",
    "runs/RUN-20260902T035644Z-c1fd8987/nnue-evolution/evolve/population-000.bin .. population-060.bin",
    "runs/RUN-20260902T035644Z-c1fd8987/nnue-evolution/pretrain/epoch-0.bin .. epoch-15.bin",
    "runs/RUN-20260902T035644Z-c1fd8987/nnue-evolution/pretrain.log",
    "runs/RUN-20260902T035644Z-c1fd8987/nnue-evolution/select.log",
    "runs/RUN-20260902T035644Z-c1fd8987/nnue-evolution/screen.log",
    "runs/RUN-20260902T035644Z-c1fd8987/nnue-evolution/stage-chain.nohup",
    "artifacts/results/EX-20260902-nnue-evolution-d3-v2-49c18bc2/RUN-20260902T035644Z-c1fd8987/manifest.json"
  ],
  "contributionIds": [
    "CT-20260902T042620Z-3b4bf7a8"
  ]
}
